{
  "version": "1.0",
  "updatedAt": "2026-02-24",
  "schema": "cohortai.testimonials.v1",
  "items": [
    {
      "id": "t001",
      "name": "Priya S.",
      "role": "Homemaker",
      "city": "Hyderabad",
      "track": "Everyday AI",
      "rating": 5,
      "quote": "I started with zero confidence. The mentors explained tools in simple language and helped me use AI for daily tasks, content, and learning.",
      "source": "WhatsApp",
      "featured": true
    },
    {
      "id": "t002",
      "name": "Rahul K.",
      "role": "Freelance Consultant",
      "city": "Pune",
      "track": "Business AI",
      "rating": 5,
      "quote": "The cohort helped me build follow-up automation and content workflows. I started seeing time savings within the first two weeks.",
      "source": "Call feedback",
      "featured": true
    },
    {
      "id": "t003",
      "name": "Akhila M.",
      "role": "Software Engineer",
      "city": "Vizag",
      "track": "Tech & Data AI",
      "rating": 5,
      "quote": "The practical sessions and review feedback were the difference. I left with portfolio-ready work instead of only notes.",
      "source": "Learner review",
      "featured": false
    },
    {
      "id": "t004",
      "name": "Sandeep R.",
      "role": "Small Business Owner",
      "city": "Vijayawada",
      "track": "Business AI",
      "rating": 5,
      "quote": "I joined for AI basics but stayed for the accountability. The mentors were patient and tailored examples to my business use-cases.",
      "source": "WhatsApp",
      "featured": false
    },
    {
      "id": "t005",
      "name": "Nandini P.",
      "role": "College Student",
      "city": "Guntur",
      "track": "Everyday AI",
      "rating": 5,
      "quote": "The assignments were simple to start and progressively better. I now know how to write prompts and present AI-assisted outputs confidently.",
      "source": "Form",
      "featured": false
    },
    {
      "id": "t006",
      "name": "Vivek T.",
      "role": "Data Analyst",
      "city": "Hyderabad",
      "track": "Tech & Data AI",
      "rating": 5,
      "quote": "Clear structure, real exercises, and mentor review. This felt like practical coaching, not generic online videos.",
      "source": "Learner review",
      "featured": true
    }
  ]
}